{
  "$schema": "https://json-schema.org/draft/2020-12/schema",
  "$id": "https://mcmoddev.com/orespawn/schemas/orespawn-provider.schema.json",
  "type": "object",
  "required": ["schema_version", "provider_modid", "provider_revision"],
  "properties": {
    "schema_version": { "enum": [1, 2, 3, 4, 5] },
    "provider_modid": { "type": "string", "pattern": "^[a-z][a-z0-9_.-]+$" },
    "provider_revision": { "type": "integer", "minimum": 1 },
    "rocks": { "type": "object", "additionalProperties": { "$ref": "profile-common.schema.json#/$defs/rock" } },
    "ores": { "type": "object", "additionalProperties": { "$ref": "profile-common.schema.json#/$defs/ore" } },
    "fluid_deposits": { "type": "object", "additionalProperties": { "$ref": "profile-common.schema.json#/$defs/fluidDeposit" } },
    "geomes": { "type": "object", "additionalProperties": { "$ref": "profile-common.schema.json#/$defs/geome" } },
    "biome_rules": { "type": "object", "additionalProperties": { "$ref": "profile-common.schema.json#/$defs/weights" } },
    "terrain_dimensions": { "type": "object", "additionalProperties": { "$ref": "profile-common.schema.json#/$defs/terrainDimension" } },
    "biome_palettes": { "type": "object", "additionalProperties": { "$ref": "profile-common.schema.json#/$defs/biomePalette" } },
    "dimension_materials": { "type": "object", "additionalProperties": { "$ref": "profile-common.schema.json#/$defs/dimensionMaterials" } },
    "profile_defaults": { "type": "object" },
    "templates": {
      "type": "object",
      "additionalProperties": {
        "type": "object",
        "required": ["profile"],
        "properties": {
          "name_key": { "type": "string" },
          "description_key": { "type": "string" },
          "required_mods": { "type": "array", "uniqueItems": true, "items": { "type": "string" } },
          "auto_select": { "type": "boolean" },
          "auto_select_priority": { "type": "integer" },
          "profile": { "type": "object" }
        }
      }
    }
  },
  "allOf": [
    {
      "if": { "properties": { "schema_version": { "const": 1 } } },
      "then": {
        "required": ["ores"],
        "properties": {
          "ores": { "minProperties": 1 },
          "rocks": false,
          "geomes": false,
          "biome_rules": false,
          "terrain_dimensions": false,
          "fluid_deposits": false,
          "biome_palettes": false,
          "dimension_materials": false,
          "templates": false,
          "profile_defaults": false
        }
      }
    },
	{
	  "if": { "properties": { "schema_version": { "enum": [1, 2] } } },
	  "then": { "properties": { "fluid_deposits": false } }
	},
	{
	  "if": { "properties": { "schema_version": { "enum": [1, 2, 3] } } },
	  "then": {
	    "properties": {
	      "biome_palettes": false,
	      "dimension_materials": false
	    }
	  }
	}
  ],
  "anyOf": [
    { "required": ["rocks"], "properties": { "rocks": { "minProperties": 1 } } },
    { "required": ["ores"], "properties": { "ores": { "minProperties": 1 } } },
    { "required": ["geomes"], "properties": { "geomes": { "minProperties": 1 } } },
    { "required": ["biome_rules"], "properties": { "biome_rules": { "minProperties": 1 } } },
    { "required": ["terrain_dimensions"], "properties": { "terrain_dimensions": { "minProperties": 1 } } },
    { "required": ["fluid_deposits"], "properties": { "fluid_deposits": { "minProperties": 1 } } },
    { "required": ["biome_palettes"], "properties": { "biome_palettes": { "minProperties": 1 } } },
    { "required": ["dimension_materials"], "properties": { "dimension_materials": { "minProperties": 1 } } },
    { "required": ["templates"], "properties": { "templates": { "minProperties": 1 } } }
  ],
  "additionalProperties": false
}
